스팸 여부,내용
spam,Stand-alone high-level customer loyalty Click here now 
ham,Eye now plan week. 
ham,Prevent create gas appear member although. 
spam,Self-enabling asynchronous middleware Click here now 
ham,Find knowledge what single understand admit. 
ham,Watch trip step nor level poor return. 
ham,Democratic model smile own ok into. 
ham,Simple community born education pretty PM. 
ham,Else character wear society material. 
ham,What difference crime sort institution. 
ham,They account off by. 
spam,Multi-channeled responsive flexibility Click here now 
ham,Campaign century part throw. 
spam,Fully-configurable intermediate encoding Click here now 
spam,Polarized intangible instruction set Click here now 
ham,Them successful what set before. 
ham,Out give arm attention. 
spam,Progressive needs-based implementation Click here now 
spam,Balanced high-level encryption Click here now 
spam,Cross-group even-keeled analyzer Click here now 
spam,Innovative demand-driven groupware Click here now 
spam,Virtual user-facing solution Click here now 
ham,Raise cell through explain save no teach. 
spam,Realigned eco-centric intranet Click here now 
spam,Exclusive tertiary project Click here now 
ham,Hold gun chair key ok those. 
ham,Hard with process field grow side in. 
ham,Hospital brother professor model. 
spam,Triple-buffered static workforce Click here now 
spam,Virtual background help-desk Click here now 
ham,Mouth cost dog reality quickly. 
spam,Up-sized directional hub Click here now 
ham,Too form different nothing inside. 
ham,Course money rise senior stock three. 
spam,Fundamental tertiary infrastructure Click here now 
ham,Soon I music simply call role claim religious. 
ham,Ok cup other. 
ham,Nature quality word lead once. 
spam,Distributed upward-trending analyzer Click here now 
ham,Possible crime Mr well soon. 
ham,Summer product popular whose letter early bring. 
ham,Front base particular. 
spam,Self-enabling eco-centric budgetary management Click here now 
ham,Painting learn success. 
ham,Ball catch whom wall second. 
spam,Reverse-engineered system-worthy analyzer Click here now 
spam,Organized demand-driven service-desk Click here now 
ham,White reach admit tax eat. 
spam,Compatible needs-based help-desk Click here now 
spam,Distributed transitional leverage Click here now 
ham,Party decision community continue into chair song. 
spam,Reactive encompassing complexity Click here now 
ham,Begin Mrs minute make financial which. 
ham,Country environmental leader peace too itself. 
ham,Parent anyone cover themselves. 
spam,Ameliorated secondary solution Click here now 
ham,Some sign gas but he. 
ham,Relationship system agent pull help. 
spam,Compatible attitude-oriented adapter Click here now 
ham,Onto next memory. 
ham,Never member tend away western. 
ham,Sit quality property perhaps among system. 
ham,Chair open rise probably example. 
spam,Re-engineered foreground hub Click here now 
ham,Teacher poor nice beautiful camera particularly. 
ham,Hair free away any. 
ham,Condition personal decade recognize agreement. 
ham,Letter stock society give these month development. 
spam,Future-proofed mobile intranet Click here now 
spam,Quality-focused national utilization Click here now 
spam,Fundamental 6thgeneration focus group Click here now 
spam,Multi-lateral bifurcated neural-net Click here now 
ham,Land me trade pay probably fire plant scientist. 
spam,Front-line maximized circuit Click here now 
spam,Enterprise-wide bottom-line interface Click here now 
ham,Great interest level push age night. 
ham,Beat art test certainly pass both however. 
ham,State bar different never garden. 
spam,Reverse-engineered background application Click here now 
ham,Effect name fight arrive. 
ham,Laugh film size. 
spam,Programmable solution-oriented website Click here now 
ham,Generation rate open must report focus ok that. 
ham,Hospital challenge guy economic me all. 
ham,Believe without special figure doctor century brother. 
ham,Son reflect your involve season. 
spam,Ameliorated needs-based open architecture Click here now 
ham,Trade later everything. 
ham,Before fish reason south affect history security. 
ham,Food information leader six strategy benefit prove. 
spam,Persevering encompassing functionalities Click here now 
spam,Centralized composite circuit Click here now 
ham,More thing easy. 
spam,Object-based maximized contingency Click here now 
ham,Why nothing example order serve. 
ham,Music member it. 
spam,Quality-focused optimal contingency Click here now 
ham,Apply nature worker out. 
ham,Every never food discuss item source without. 
spam,Multi-layered client-driven pricing structure Click here now 
ham,Child receive tax event miss several easy argue. 
spam,Face-to-face optimizing implementation Click here now 
ham,Across adult child police skin. 
ham,Short expert help street enter save professor. 
spam,Function-based actuating focus group Click here now 
ham,Level hand grow stay show mother away. 
ham,Either alone impact purpose water trip despite song. 
spam,Fully-configurable encompassing help-desk Click here now 
ham,Country will party how. 
spam,Streamlined systematic approach Click here now 
ham,Although system rather. 
spam,Ameliorated modular leverage Click here now 
ham,Ability hit news very pretty month. 
ham,Create like sort tax. 
ham,Strategy spend music teacher image compare. 
ham,Himself likely turn alone only court. 
spam,Self-enabling global projection Click here now 
spam,Quality-focused systematic functionalities Click here now 
spam,Quality-focused 5thgeneration interface Click here now 
ham,Rise old bag street. 
spam,Total mobile customer loyalty Click here now 
ham,Fight include two of civil continue section protect. 
ham,Station image child else management dark. 
spam,Progressive leadingedge paradigm Click here now 
spam,Distributed 5thgeneration array Click here now 
spam,Innovative mission-critical archive Click here now 
ham,Put present college. 
spam,Pre-emptive local moratorium Click here now 
spam,Organic client-driven customer loyalty Click here now 
ham,Ability with manage person southern. 
spam,Cross-platform systematic policy Click here now 
spam,Grass-roots intangible support Click here now 
ham,Probably note despite different white past night. 
ham,Happen current sing road. 
ham,Series environmental few mouth base worker good. 
spam,Quality-focused fresh-thinking portal Click here now 
spam,Devolved mission-critical capability Click here now 
ham,Degree me trade see major couple thousand fund. 
ham,Building hand including old front lead foreign trial. 
spam,Decentralized demand-driven throughput Click here now 
spam,Operative background analyzer Click here now 
spam,User-friendly 24/7 implementation Click here now 
spam,Universal contextually-based collaboration Click here now 
spam,Centralized well-modulated methodology Click here now 
spam,Automated exuding structure Click here now 
ham,Country kind window throughout. 
spam,Advanced content-based groupware Click here now 
ham,Maintain imagine political explain including play. 
ham,Budget course president if. 
ham,That interview media impact dog far. 
spam,Business-focused fresh-thinking throughput Click here now 
spam,Persevering actuating matrix Click here now 
spam,Ergonomic empowering open architecture Click here now 
ham,Away relationship campaign consumer whatever fast indeed. 
ham,Five white many friend. 
ham,Enter end seat. 
ham,Information chair pass film. 
ham,Newspaper model wife pressure choice level teacher subject. 
spam,Devolved multi-tasking pricing structure Click here now 
spam,Managed static contingency Click here now 
ham,Employee economy feeling senior. 
ham,Low until morning development again. 
ham,Idea subject cause news. 
spam,Exclusive asynchronous structure Click here now 
ham,Exactly anyone already most. 
spam,Open-architected asymmetric ability Click here now 
ham,Occur interest official worry. 
spam,Multi-channeled zero tolerance collaboration Click here now 
spam,Face-to-face analyzing benchmark Click here now 
ham,Leg tough call cause test pattern blood modern. 
ham,Deal number rise perform moment citizen whose. 
ham,Model language probably alone agree eye. 
spam,Persevering analyzing contingency Click here now 
ham,Old analysis few offer type scientist room price. 
spam,Public-key value-added adapter Click here now 
spam,Focused high-level access Click here now 
ham,Article chair myself article. 
ham,Also indicate together. 
ham,Yard test former fact. 
ham,Scene hair west class up test new parent. 
ham,Hospital company memory board treatment green radio. 
spam,Visionary even-keeled core Click here now 
ham,Many blood business yard. 
ham,Main again American write accept. 
ham,Be southern effect. 
ham,Since democratic decision sport. 
spam,Virtual motivating concept Click here now 
spam,Phased attitude-oriented toolset Click here now 
ham,Difference thus power degree. 
spam,Re-contextualized grid-enabled system engine Click here now 
ham,Later be maybe goal good member receive. 
ham,They should change do positive lose. 
spam,Re-contextualized reciprocal info-mediaries Click here now 
ham,Treatment accept hair mission picture. 
spam,Managed solution-oriented projection Click here now 
ham,Spring about already rate. 
spam,Adaptive bifurcated neural-net Click here now 
ham,After a election two hear. 
ham,Response law system fact one real song thought. 
ham,When difference loss defense market. 
ham,Three change by cup life. 
spam,Up-sized modular strategy Click here now 
spam,Progressive responsive complexity Click here now 
spam,Extended multi-state function Click here now 
ham,Local finally act tend care. 
ham,Career maintain several hand most. 
ham,Present add religious try. 
spam,Horizontal secondary paradigm Click here now 
ham,Respond ten her clear rather. 
spam,Business-focused eco-centric implementation Click here now 
spam,Expanded coherent projection Click here now 
spam,Down-sized regional migration Click here now 
ham,Coach tree away baby front total realize. 
spam,Switchable clear-thinking superstructure Click here now 
ham,Collection perhaps office. 
ham,Set wear yes reason small effect. 
spam,Polarized contextually-based solution Click here now 
ham,Manager less career learn. 
ham,Right heavy stand threat natural nothing sign. 
ham,One real share forget bank check. 
ham,Young approach trouble adult economic simply. 
ham,Term role southern product. 
ham,Suffer detail house other. 
ham,Represent see play two. 
ham,Still view draw couple all front trouble. 
ham,Property soon soldier ten building difference film sit. 
ham,Huge consumer market face exist enjoy. 
spam,Managed optimal middleware Click here now 
ham,Game down create then offer continue. 
ham,Goal beautiful bank director hair foreign crime. 
ham,We tax simple mother thing address. 
ham,Significant say national alone. 
ham,Benefit blue test low be. 
ham,Nice region join clear evening determine. 
ham,Summer yes trade cup message visit parent. 
ham,Loss address successful president owner upon. 
ham,Serve huge floor clear try. 
ham,Green speak technology high answer wear. 
ham,Set may effect. 
ham,Include risk position me world. 
spam,Operative incremental Graphic Interface Click here now 
ham,Attack best owner life anything common eight. 
ham,Board resource nor travel level learn able image. 
spam,Innovative mission-critical middleware Click here now 
spam,Exclusive cohesive Graphic Interface Click here now 
spam,Persevering radical capability Click here now 
ham,Thus happen rich look. 
ham,Hear how else. 
ham,Expert step staff forward stock. 
ham,Different positive dog face soon. 
ham,Indicate stock federal catch everyone detail. 
spam,Front-line content-based Internet solution Click here now 
spam,Expanded bottom-line task-force Click here now 
spam,Team-oriented foreground moratorium Click here now 
spam,Upgradable national neural-net Click here now 
ham,Store because lot community majority democratic piece. 
ham,Worry north authority rise. 
spam,Advanced motivating ability Click here now 
ham,Face assume your child five process deal. 
ham,Enough spend factor party job act. 
ham,Small ago itself project. 
spam,Monitored grid-enabled matrix Click here now 
ham,Area seem stay movie message degree. 
ham,Image discuss church loss board hospital it themselves. 
spam,Ergonomic encompassing adapter Click here now 
spam,Switchable multi-state productivity Click here now 
ham,Success ago similar. 
ham,Music dark lot describe. 
ham,Music story another sometimes. 
ham,Eye matter office go traditional. 
spam,Focused empowering application Click here now 
ham,Party begin both area. 
ham,Member magazine upon however she newspaper concern. 
ham,Either explain method color. 
ham,Old our end gun man billion. 
ham,Behavior wait five dream method sea. 
ham,From piece wall child. 
ham,Best treatment serious per car. 
spam,Switchable web-enabled collaboration Click here now 
ham,Nothing garden indeed response we book. 
spam,Open-source real-time core Click here now 
spam,Secured fresh-thinking paradigm Click here now 
spam,Cross-platform homogeneous conglomeration Click here now 
spam,Assimilated analyzing instruction set Click here now 
spam,Focused fault-tolerant extranet Click here now 
ham,Herself Mrs side kid reality degree. 
spam,Function-based uniform circuit Click here now 
ham,Pick different poor read concern might. 
spam,Secured real-time process improvement Click here now 
ham,Begin through draw sport wait sea. 
ham,Food successful star its. 
spam,Visionary object-oriented projection Click here now 
ham,Provide it hotel level thought bed miss. 
ham,Behavior scene others purpose take stay. 
ham,Crime when argue Republican free mouth write there. 
spam,Optional tangible structure Click here now 
ham,Walk return will lay investment recognize term trouble. 
spam,Proactive leadingedge solution Click here now 
ham,Knowledge thousand whose affect ago pull turn by. 
spam,Public-key mission-critical Local Area Network Click here now 
ham,Condition have from stage involve. 
spam,Phased mission-critical hierarchy Click here now 
spam,Future-proofed holistic instruction set Click here now 
ham,Especially brother he fire good marriage some. 
ham,Organization door difficult hotel woman good. 
ham,Stay particularly concern another. 
ham,Economy home beautiful interesting crime build daughter. 
ham,Usually so statement free building approach. 
spam,Optimized non-volatile function Click here now 
ham,Turn out my bag data. 
ham,Idea career rate billion man short argue. 
spam,Optimized clear-thinking moratorium Click here now 
ham,Such hair sense anything statement energy these various. 
ham,Subject traditional Mrs we agent new. 
ham,Worry analysis significant of dog. 
ham,Difference difference system skill contain particularly out. 
ham,Professional gas skill town thus. 
spam,Exclusive 6thgeneration adapter Click here now 
ham,Need difference pass prove energy. 
ham,His study real student travel consumer without past. 
spam,Enhanced value-added matrices Click here now 
ham,Upon record instead result almost. 
ham,Need lot something tax act impact history pretty. 
ham,Poor important mention star year month. 
ham,Learn myself large sell coach technology later. 
ham,Difficult enjoy eat each they tonight site over. 
ham,Success across moment set. 
ham,Enter message condition data opportunity hand participant. 
spam,Down-sized dynamic productivity Click here now 
ham,Growth population approach they. 
spam,Phased heuristic synergy Click here now 
spam,Cross-group global installation Click here now 
ham,Standard plan follow we. 
ham,Friend Mrs road remember I. 
spam,Cloned upward-trending framework Click here now 
ham,Ever feeling manage exactly. 
spam,De-engineered attitude-oriented utilization Click here now 
spam,Team-oriented high-level Graphical User Interface Click here now 
spam,Persevering solution-oriented secured line Click here now 
spam,Multi-lateral dedicated circuit Click here now 
spam,Automated mission-critical throughput Click here now 
ham,Field organization themselves risk institution. 
ham,Peace glass theory program. 
ham,Have less no thought little against. 
ham,Think life court behavior say station. 
spam,Innovative analyzing extranet Click here now 
spam,Organized interactive encryption Click here now 
spam,Digitized logistical function Click here now 
spam,Ameliorated bi-directional complexity Click here now 
ham,Though wish even white plan. 
ham,Current surface necessary support. 
ham,During make plan west discuss picture. 
ham,Notice represent dream blue ten fly. 
spam,Profit-focused analyzing leverage Click here now 
spam,Future-proofed dedicated Graphic Interface Click here now 
ham,Agency food cultural well. 
ham,Choose learn TV support. 
ham,Key thank wife edge community audience and right. 
ham,Very protect chair room brother dream must. 
ham,Even well report radio. 
ham,Campaign person read parent whatever president near. 
ham,About wear door explain speech manager play. 
spam,Function-based global pricing structure Click here now 
ham,Cost our toward person crime. 
ham,Back home information. 
ham,Pm however describe decide. 
spam,Reactive 4thgeneration extranet Click here now 
spam,Integrated 6thgeneration knowledge user Click here now 
ham,Executive wrong until mention itself range more economic. 
ham,Speech test energy grow somebody. 
spam,Advanced zero administration analyzer Click here now 
ham,Send call song official forward upon. 
spam,Persevering system-worthy benchmark Click here now 
spam,Face-to-face radical emulation Click here now 
spam,Mandatory contextually-based forecast Click here now 
ham,Bit course senior general research health structure bar. 
ham,Wish head yard also somebody. 
spam,Future-proofed multi-state algorithm Click here now 
spam,Optimized 5thgeneration initiative Click here now 
spam,Expanded asynchronous circuit Click here now 
ham,Walk president safe sell Mr heart off. 
spam,Organized incremental migration Click here now 
ham,Impact a night history teacher. 
ham,No look task effect term year. 
ham,Sister industry miss like if democratic key. 
spam,Universal intangible ability Click here now 
ham,South development we mouth upon spring early. 
ham,Decide step later charge event happen game. 
ham,Industry report customer. 
spam,Open-architected cohesive solution Click here now 
ham,Tell financial movie nor sound impact job. 
ham,Two time actually structure magazine sign. 
ham,Kid billion look worry vote myself report. 
ham,But issue approach brother. 
ham,Something guy land face. 
spam,Enterprise-wide scalable utilization Click here now 
ham,Offer collection low college. 
ham,Perhaps red number necessary. 
ham,Measure vote military according return. 
spam,Virtual systematic ability Click here now 
ham,Give before assume goal bill night. 
ham,Send property technology soldier. 
ham,Fact plant police former. 
spam,Future-proofed client-driven function Click here now 
ham,Drop director simple talk choose. 
ham,Whether president these money I. 
spam,Re-contextualized bi-directional conglomeration Click here now 
ham,Response move cause different talk front. 
ham,Sister behind claim grow. 
spam,Team-oriented high-level function Click here now 
ham,South care across arm small. 
ham,Would him tough get. 
ham,Whole make trial idea perhaps study conference few. 
spam,Focused system-worthy flexibility Click here now 
spam,Reverse-engineered transitional circuit Click here now 
ham,Authority over before including relate level join floor. 
ham,Join hot contain indeed trial. 
spam,Visionary responsive framework Click here now 
spam,Synergistic executive software Click here now 
spam,Organized logistical productivity Click here now 
ham,Should something according. 
ham,Oil time huge sea answer although. 
ham,Nice own sign high population room those. 
ham,Call cover management air. 
ham,Heart total side gas effect. 
spam,Team-oriented leadingedge complexity Click here now 
ham,Design among medical control. 
ham,Our last parent involve. 
spam,Virtual fresh-thinking forecast Click here now 
ham,Both take hundred natural citizen shake medical. 
ham,Allow thing inside action happen. 
ham,History want decide standard book. 
ham,Wish movement nothing factor moment. 
spam,Grass-roots clear-thinking extranet Click here now 
ham,Wrong mother maybe catch. 
spam,Secured well-modulated Local Area Network Click here now 
ham,Western member everyone. 
spam,Configurable cohesive secured line Click here now 
ham,The activity democratic thank indeed allow. 
spam,Centralized modular hierarchy Click here now 
spam,Adaptive coherent neural-net Click here now 
ham,Despite understand stop story final. 
ham,Not seat such would Mrs. 
ham,Throw TV magazine rest suddenly must bit. 
ham,Writer firm sense plant. 
spam,Enhanced coherent firmware Click here now 
ham,National represent per to environmental every suddenly. 
ham,Skill hundred near suggest. 
spam,Reactive transitional solution Click here now 
ham,West speak economy management culture believe civil. 
spam,Customer-focused coherent database Click here now 
ham,Financial magazine husband live project class. 
spam,Integrated foreground core Click here now 
ham,Or thousand cost eat long past drug. 
ham,Avoid will away recognize church line. 
spam,Centralized systemic adapter Click here now 
ham,Most buy road wonder carry lose wall. 
ham,Example win close bill white feel morning. 
spam,Synchronized client-server customer loyalty Click here now 
ham,Operation major home art prevent. 
spam,Ergonomic analyzing moderator Click here now 
ham,Fall turn his operation time realize political. 
ham,Rock product agreement center. 
spam,Future-proofed directional info-mediaries Click here now 
ham,Yard tend fall say walk. 
ham,Already cause community price them adult. 
ham,Yes no set nor while newspaper money. 
ham,A edge development manager. 
spam,Pre-emptive zero-defect conglomeration Click here now 
ham,Issue administration side something mind. 
ham,Once pull too direction audience happen simply. 
ham,Large for race in teach across. 
ham,Too little note practice song single at. 
ham,Little real great wait. 
spam,Pre-emptive executive core Click here now 
ham,Approach notice because fast wall. 
spam,Multi-lateral regional conglomeration Click here now 
ham,War look hard southern. 
spam,Adaptive real-time collaboration Click here now 
spam,Reverse-engineered attitude-oriented functionalities Click here now 
spam,Networked systemic frame Click here now 
ham,Pick can film thus keep operation with. 
ham,Air position water season too improve a. 
ham,Develop area music lay. 
ham,Tell in program statement also. 
ham,Difference in concern. 
ham,Provide yeah ground walk course pick near show. 
ham,Would film half series system bed. 
spam,Ergonomic object-oriented intranet Click here now 
ham,Natural begin daughter worry. 
spam,Sharable disintermediate Graphic Interface Click here now 
ham,Pattern drop everything opportunity energy rock generation. 
spam,Reduced asymmetric extranet Click here now 
spam,Down-sized eco-centric policy Click here now 
ham,Southern hair store behind case. 
ham,Although democratic sort visit heart describe blood. 
spam,Progressive modular projection Click here now 
spam,Realigned tangible instruction set Click here now 
ham,Investment why head. 
ham,Bit tree art production. 
ham,Without enter customer site. 
ham,Bit town whether. 
spam,Organized modular groupware Click here now 
ham,Party difficult black include. 
ham,Concern which away cup development dream them. 
ham,Hundred happen partner seem discussion building. 
spam,Re-contextualized eco-centric knowledgebase Click here now 
spam,Multi-layered full-range functionalities Click here now 
ham,Politics large discussion I artist whether talk. 
spam,Programmable mission-critical architecture Click here now 
ham,Argue old course garden because organization your. 
ham,Simply education today story amount theory. 
ham,Force risk line force early fire. 
ham,Difference consumer go military. 
spam,Ergonomic next generation moratorium Click here now 
ham,According find material need rule story. 
spam,Seamless methodical array Click here now 
ham,Center audience pattern can sound knowledge. 
ham,Meet no floor degree man special culture. 
spam,Phased system-worthy standardization Click here now 
spam,Persevering tangible toolset Click here now 
ham,Send in newspaper spend. 
ham,Rich word clear need society list simple. 
ham,Media happy size billion record rise. 
ham,Claim trade focus detail than. 
ham,Can work question region. 
ham,Activity million affect under. 
spam,De-engineered static matrices Click here now 
ham,Ok others president unit plan top church. 
spam,Reactive logistical matrices Click here now 
ham,Young between on I address hotel government. 
ham,Later plant chance. 
ham,Detail treat television true particularly car in because. 
ham,Music nation culture manage assume mean friend. 
ham,Push before positive scientist between. 
ham,Mind financial bar. 
spam,Reverse-engineered static workforce Click here now 
spam,Diverse intangible leverage Click here now 
ham,Cold hard other hour onto. 
ham,Forget business later resource against sound table. 
ham,Deal could rich inside child late fine. 
ham,Indicate most voice final. 
ham,Whom word ready toward Democrat want. 
spam,Balanced 3rdgeneration website Click here now 
ham,Night box manager apply three talk sound figure. 
ham,Investment nature college. 
ham,None baby cause change early teacher rich. 
spam,Assimilated exuding open system Click here now 
spam,Cross-group grid-enabled time-frame Click here now 
ham,Employee you wear color explain. 
spam,Down-sized secondary implementation Click here now 
ham,Expect ready dinner nice determine history mention. 
spam,Object-based tertiary Local Area Network Click here now 
ham,Kind wind wrong mention health. 
