스팸 여부,내용
ham,Sometimes fast require start others later. 
spam,Realigned client-driven benchmark Click here now 
ham,Allow list this social young prove according teach. 
spam,Vision-oriented hybrid hierarchy Click here now 
spam,Phased cohesive intranet Click here now 
spam,Face-to-face dedicated capability Click here now 
ham,Sound upon hope worker citizen boy. 
spam,Customizable client-driven customer loyalty Click here now 
ham,Offer ago this detail main rest deep. 
spam,Front-line mobile initiative Click here now 
ham,Official gun hear face. 
ham,Her fire season realize growth some. 
ham,Camera challenge clear build. 
ham,Though matter anything difference. 
ham,Whole forget condition from career concern. 
spam,Innovative demand-driven data-warehouse Click here now 
ham,Kind image education material. 
ham,Very over participant woman. 
spam,Pre-emptive didactic orchestration Click here now 
spam,Reduced intermediate Internet solution Click here now 
ham,Man occur step choose student. 
spam,Down-sized reciprocal array Click here now 
ham,Father himself sister visit technology husband beautiful then. 
spam,Synergistic maximized Local Area Network Click here now 
spam,Customer-focused high-level product Click here now 
ham,Raise change build issue. 
ham,West range form government. 
spam,Programmable client-server implementation Click here now 
spam,Inverse fresh-thinking algorithm Click here now 
spam,Optimized discrete moderator Click here now 
ham,Community loss in use wind. 
ham,Much range put husband gas owner good design. 
spam,Versatile client-server pricing structure Click here now 
spam,Advanced even-keeled product Click here now 
ham,Member just boy difference parent seat development. 
spam,Re-engineered multimedia algorithm Click here now 
ham,Evening reveal instead throw other. 
ham,Oil child them gun career morning sure method. 
spam,Cross-platform bandwidth-monitored forecast Click here now 
ham,Environmental growth debate mean. 
spam,Horizontal impactful core Click here now 
ham,Truth before fine person good. 
ham,Authority three threat phone idea along campaign. 
spam,Customer-focused content-based info-mediaries Click here now 
spam,Future-proofed fault-tolerant open architecture Click here now 
ham,Quickly anything when thought own live. 
ham,Suddenly group rest husband skill artist identify. 
ham,Education test total. 
ham,Staff dinner leader level. 
ham,Best partner decide. 
spam,Fully-configurable grid-enabled solution Click here now 
ham,Avoid response increase lead interest Republican. 
spam,Implemented actuating intranet Click here now 
ham,Provide exactly everybody member region. 
ham,Dream majority drive summer chair suggest travel. 
spam,Business-focused interactive throughput Click here now 
spam,Sharable user-facing throughput Click here now 
ham,Rather office professional star much nice cold mouth. 
spam,Streamlined even-keeled benchmark Click here now 
ham,East similar whether machine relationship. 
ham,Call wind maintain something financial author sign. 
ham,Economy result born stuff another together could yourself. 
ham,Fall buy knowledge choose treatment treat. 
ham,Structure truth man most clearly. 
spam,Grass-roots web-enabled attitude Click here now 
spam,Total actuating forecast Click here now 
ham,Per specific table population hair simply research. 
spam,Balanced intermediate hub Click here now 
spam,Ameliorated global paradigm Click here now 
ham,Probably hotel toward approach fast build road room. 
spam,Phased reciprocal challenge Click here now 
ham,Mean remain else history nice street consider. 
spam,Advanced 6thgeneration orchestration Click here now 
spam,Sharable stable attitude Click here now 
ham,Hit couple contain would chair base shoulder. 
ham,Risk religious factor financial religious produce travel. 
ham,Collection pass herself policy. 
ham,Bar player like television. 
ham,Save question western kitchen million. 
ham,Sit century inside. 
ham,Investment down Republican what movement especially hold. 
spam,Public-key multi-state orchestration Click here now 
ham,Serious already which. 
ham,Itself likely fund. 
spam,Realigned intangible knowledgebase Click here now 
spam,Universal impactful ability Click here now 
ham,Personal western simply young rather heart war certainly. 
ham,Whose ok often summer group. 
spam,Upgradable well-modulated archive Click here now 
ham,Must throw human receive small sister staff. 
spam,Implemented homogeneous Graphical User Interface Click here now 
spam,Enhanced empowering matrix Click here now 
ham,Fast standard dark bad true continue. 
ham,Clearly side network president scene radio matter. 
ham,Development community yet modern. 
ham,Push gun white if. 
spam,Vision-oriented interactive productivity Click here now 
spam,Right-sized zero tolerance service-desk Click here now 
ham,Reflect they government how. 
spam,Pre-emptive non-volatile analyzer Click here now 
ham,Dinner consider scene good job manage. 
ham,Land east arrive card boy nice then brother. 
spam,Business-focused fault-tolerant knowledge user Click here now 
ham,Effort dinner measure page. 
ham,Process cold huge hold especially. 
ham,Policy high clearly site enough. 
ham,Yet appear store smile boy impact adult trial. 
ham,Apply effect newspaper difference kind food. 
spam,Mandatory encompassing info-mediaries Click here now 
ham,Role middle work along. 
spam,Phased multimedia alliance Click here now 
ham,Today discover include name first teacher upon. 
spam,Realigned 5thgeneration attitude Click here now 
spam,Horizontal multi-state capacity Click here now 
spam,Operative eco-centric success Click here now 
ham,Sport art director. 
ham,See democratic energy anyone. 
ham,Consumer rate people sell so without free. 
ham,Condition catch consumer send tend continue. 
spam,Ameliorated reciprocal service-desk Click here now 
ham,Mention mission lose bring be name. 
ham,Every impact mother two all start seem simple. 
ham,Pressure yet before fall family. 
spam,Digitized mobile interface Click here now 
ham,Maybe positive meet pattern. 
spam,Pre-emptive regional Graphic Interface Click here now 
spam,Cross-group needs-based function Click here now 
ham,Late fact what security hand buy pretty score. 
ham,Act guess woman ahead cause down ability. 
spam,Open-source client-server algorithm Click here now 
spam,De-engineered even-keeled monitoring Click here now 
spam,Realigned solution-oriented structure Click here now 
spam,Reactive static capability Click here now 
ham,However paper side now. 
ham,True fall world understand soldier individual interest. 
spam,Switchable upward-trending hardware Click here now 
ham,So pay training sort sea. 
ham,Of girl wide theory sell together institution as. 
spam,Managed contextually-based benchmark Click here now 
ham,Apply cover style available talk. 
spam,Re-engineered 5thgeneration alliance Click here now 
spam,Expanded incremental moratorium Click here now 
ham,Into job would full yard. 
spam,Down-sized logistical standardization Click here now 
ham,Visit left manager. 
spam,Implemented cohesive throughput Click here now 
spam,Object-based zero tolerance superstructure Click here now 
spam,Centralized discrete benchmark Click here now 
spam,Persevering 4thgeneration workforce Click here now 
ham,Still reveal kid son these not visit. 
spam,Right-sized intermediate task-force Click here now 
spam,Multi-tiered directional moderator Click here now 
ham,Head song ability thought statement offer order. 
spam,Switchable user-facing success Click here now 
spam,Operative coherent structure Click here now 
ham,Point each hot sea mention floor forward though. 
spam,Configurable context-sensitive function Click here now 
spam,Persevering foreground approach Click here now 
spam,Switchable web-enabled intranet Click here now 
ham,Common avoid authority guy arrive purpose. 
ham,Nothing future significant us weight hair so phone. 
ham,Set market service mission major her. 
spam,Phased tangible artificial intelligence Click here now 
ham,Feeling day newspaper blue certainly reduce build toward. 
ham,Born government method. 
ham,Staff figure view prevent improve look head push. 
spam,Re-contextualized composite product Click here now 
ham,Road body remain address crime customer election. 
ham,Play camera month my TV explain student old. 
ham,Under fire loss blood. 
ham,Base today decision us should old. 
ham,Too much view lay commercial scientist adult serious. 
ham,Between boy character protect surface. 
ham,Number free north effect. 
ham,Federal join simple democratic particularly. 
ham,Since mission single wrong. 
spam,Robust disintermediate forecast Click here now 
spam,Ameliorated foreground time-frame Click here now 
ham,Surface class deal world special single interesting. 
ham,Record nice home outside send. 
spam,Networked composite parallelism Click here now 
spam,Proactive clear-thinking utilization Click here now 
ham,Deal become senior hot. 
spam,Streamlined high-level migration Click here now 
spam,Exclusive encompassing matrices Click here now 
ham,Hair may rest. 
ham,Type growth maybe order billion however guess. 
ham,Class also maintain measure. 
spam,Open-source tertiary Graphic Interface Click here now 
ham,Anything find we sing point soldier. 
ham,Out sea begin worry serious issue expert. 
spam,Devolved coherent service-desk Click here now 
ham,Talk food relationship spring memory majority. 
ham,Agent actually three. 
spam,Exclusive uniform array Click here now 
ham,Want more never. 
ham,Allow example field single maintain citizen president. 
spam,Robust non-volatile process improvement Click here now 
spam,Multi-lateral dedicated success Click here now 
spam,Inverse asymmetric standardization Click here now 
ham,Shake guess seat around operation. 
spam,Upgradable hybrid access Click here now 
spam,Seamless systemic solution Click here now 
spam,Secured client-server conglomeration Click here now 
spam,Visionary zero administration algorithm Click here now 
spam,Visionary attitude-oriented moderator Click here now 
spam,Assimilated mission-critical customer loyalty Click here now 
ham,One leader attack person exist upon structure. 
ham,Today mean scientist around certainly civil science. 
ham,Nature candidate open street fast that approach. 
ham,Myself available our day reduce. 
ham,Crime eye key protect. 
spam,Expanded asymmetric neural-net Click here now 
ham,Field new evening tend among computer. 
ham,Tonight my daughter front analysis. 
spam,Balanced stable leverage Click here now 
ham,Development finish school education. 
spam,Multi-layered optimizing framework Click here now 
ham,For sister impact center treatment really history. 
ham,Forget article owner word since. 
ham,Beautiful up attack anyone them understand they. 
ham,Old blue away staff phone. 
spam,Mandatory asymmetric access Click here now 
ham,Call pull like detail film house. 
ham,Surface community son building detail risk draw. 
ham,He east floor occur not loss water. 
ham,Clearly this pass particularly. 
spam,Up-sized fault-tolerant hardware Click here now 
spam,Re-contextualized zero administration matrix Click here now 
ham,Military rather deep imagine wide own. 
spam,Reactive zero-defect support Click here now 
ham,Religious now all effort song standard five. 
ham,Development two lawyer treat after. 
ham,Top turn society than my. 
spam,Public-key object-oriented adapter Click here now 
spam,Vision-oriented analyzing protocol Click here now 
ham,List onto beat to. 
spam,Robust value-added structure Click here now 
ham,Stand stuff training act. 
spam,Optional web-enabled analyzer Click here now 
ham,Worker up activity compare never grow. 
ham,Rise yard recently here him list. 
ham,Them model bad bad. 
ham,Street institution worker knowledge. 
ham,Continue attention skin race TV. 
ham,Fire improve single particularly center century. 
spam,Centralized tangible pricing structure Click here now 
ham,Whole article address better. 
ham,Occur successful recognize address face think. 
ham,Somebody career image. 
ham,Resource window raise investment. 
spam,Ergonomic value-added throughput Click here now 
spam,Centralized bottom-line projection Click here now 
ham,Fear threat over understand. 
ham,Foreign similar exist. 
ham,Consider produce very successful agree by Democrat network. 
ham,Source heart firm appear have near. 
ham,None both attention wait arm concern reflect. 
spam,User-centric multi-state open architecture Click here now 
ham,Recent history citizen tonight perform. 
ham,Who carry four drive. 
spam,Customizable tertiary Internet solution Click here now 
spam,Expanded contextually-based array Click here now 
ham,A Republican anyone even million significant race. 
spam,Quality-focused systemic utilization Click here now 
spam,Reverse-engineered tangible website Click here now 
spam,Synergized user-facing help-desk Click here now 
spam,Mandatory 3rdgeneration Graphic Interface Click here now 
ham,Ever again moment usually meet sell. 
ham,Produce subject true fear hit attack partner. 
ham,Open choice owner Republican respond fast treatment. 
ham,Expect pull never push dark shake. 
ham,Grow prepare year subject need. 
spam,Devolved regional artificial intelligence Click here now 
ham,Very customer budget buy worker quality reflect. 
spam,Cross-platform transitional standardization Click here now 
ham,Of month party tough former keep section. 
ham,Hair federal work. 
ham,Collection per say figure ago glass subject. 
spam,Organic user-facing database Click here now 
ham,Green laugh never and easy author group. 
spam,Front-line regional functionalities Click here now 
ham,Street shake dream bank compare may. 
spam,Team-oriented non-volatile hierarchy Click here now 
ham,Important child fill stuff cup window. 
ham,Surface individual see meet on student. 
spam,Open-architected cohesive methodology Click here now 
ham,Too security apply lead pretty past. 
spam,Exclusive web-enabled hardware Click here now 
spam,Compatible scalable secured line Click here now 
ham,Television blue character total. 
ham,Shoulder short money time probably ok evening mouth. 
ham,Parent cover itself pressure. 
spam,Organized optimizing monitoring Click here now 
ham,Number over stage activity protect. 
ham,Deal difficult fine home once defense money. 
ham,Teacher own money while team important government. 
ham,Miss yourself much throw catch claim specific. 
spam,Down-sized context-sensitive strategy Click here now 
ham,Low throughout believe must enjoy. 
ham,Away close necessary protect listen like. 
ham,Situation task least eye. 
ham,Establish personal surface rule building. 
spam,Phased stable strategy Click here now 
ham,Official tell account right big visit building join. 
ham,War down around. 
spam,Programmable zero-defect encryption Click here now 
ham,Increase station modern agreement letter kid. 
spam,Expanded systemic infrastructure Click here now 
ham,Forward could change approach peace perhaps play. 
spam,Innovative full-range extranet Click here now 
ham,Reflect both off. 
ham,You already stop couple drive structure. 
ham,Town former meet. 
spam,Extended upward-trending support Click here now 
ham,Policy know final media along. 
ham,Successful huge easy society mission argue tell machine. 
spam,Extended foreground definition Click here now 
spam,Self-enabling 5thgeneration capability Click here now 
ham,Though health serious learn word. 
ham,Class region site act half. 
ham,Side easy but site. 
ham,Staff set door whose begin purpose agent father. 
spam,Secured holistic conglomeration Click here now 
ham,Go before prevent medical join. 
ham,Young out occur environmental computer front. 
ham,Wonder relate visit suggest market require. 
ham,Gas ever five outside boy perform little. 
spam,Self-enabling non-volatile firmware Click here now 
ham,Almost now partner rather sell cost. 
spam,Reduced impactful circuit Click here now 
spam,Front-line contextually-based intranet Click here now 
spam,Reverse-engineered mobile core Click here now 
ham,Late ask ten continue. 
spam,Intuitive well-modulated algorithm Click here now 
ham,Require general family agent clear anyone record every. 
ham,Fact baby establish. 
spam,Switchable foreground knowledgebase Click here now 
ham,Wait more remember air. 
spam,Ergonomic clear-thinking open architecture Click here now 
ham,Computer even care in fear bank set. 
ham,Husband newspaper them view dinner here. 
ham,General hope suffer change expect natural kind stop. 
spam,Synchronized maximized success Click here now 
spam,Phased didactic leverage Click here now 
ham,Him security space when weight training song. 
spam,Profit-focused mobile toolset Click here now 
ham,Establish bit check cut go end. 
spam,Cross-platform exuding extranet Click here now 
ham,Wish continue more dark significant test ball. 
ham,Scene position character either pattern player. 
spam,Persistent multimedia solution Click here now 
ham,Actually stuff family wear feeling. 
ham,Thousand Congress system instead. 
ham,Owner around policy part have practice treat girl. 
ham,Be design bad half movie. 
spam,Sharable 6thgeneration application Click here now 
spam,Sharable modular focus group Click here now 
ham,Spend movement happen region stay. 
ham,Scene before crime chair style cultural. 
ham,Truth send source. 
ham,Tax building return sea. 
ham,Hour material both ability. 
spam,Reactive tangible Local Area Network Click here now 
spam,Visionary heuristic intranet Click here now 
spam,Enterprise-wide value-added artificial intelligence Click here now 
ham,Born where individual organization. 
spam,Right-sized empowering adapter Click here now 
spam,Synchronized responsive artificial intelligence Click here now 
spam,Triple-buffered local leverage Click here now 
spam,Fully-configurable background hierarchy Click here now 
ham,Administration news recent very despite land. 
ham,Dark might low week green maybe. 
ham,Over white she hear today side last. 
ham,Lot until season bring newspaper staff movie deep. 
spam,Right-sized interactive algorithm Click here now 
ham,Respond meeting many share middle none. 
ham,Result action join sound wish. 
spam,Adaptive global customer loyalty Click here now 
ham,Soon shake future business choose wall need. 
ham,Recently tonight another single to experience. 
ham,Beautiful chance common American. 
ham,Focus walk describe start dog. 
ham,Recently production people according out deep sound. 
ham,Beautiful bank during return teach relationship beyond. 
ham,Management option recently officer candidate office own strong. 
ham,Since month majority option industry. 
ham,Plan eight almost put. 
spam,Operative 24/7 forecast Click here now 
spam,Switchable 24/7 support Click here now 
spam,Managed exuding portal Click here now 
ham,Tonight they task difference staff. 
ham,Argue sell compare. 
ham,Best thousand act listen eight house happy. 
ham,Customer agree top truth try military around edge. 
spam,Customizable dynamic superstructure Click here now 
ham,Worker various amount walk as. 
