스팸 여부,내용
spam,Triple-buffered holistic synergy Click here now 
ham,Than officer particular age pick behind less yes. 
ham,Others talk page born. 
ham,Get president star story man how. 
spam,Advanced non-volatile strategy Click here now 
spam,Expanded value-added leverage Click here now 
spam,Secured interactive attitude Click here now 
spam,Ameliorated composite open system Click here now 
ham,Voice hair suddenly total myself subject. 
spam,Profound clear-thinking methodology Click here now 
ham,Official word simply their along. 
ham,Against care cold build. 
spam,Team-oriented transitional success Click here now 
ham,Husband manager Congress call story case. 
ham,Sit place study. 
spam,Distributed asymmetric knowledgebase Click here now 
spam,Organic next generation knowledgebase Click here now 
ham,Child nice ability decade idea range. 
ham,Morning court word develop. 
ham,Hot reason significant including. 
ham,Despite side step himself artist cup white. 
spam,User-centric transitional product Click here now 
ham,Simple recently up provide rather public. 
ham,Standard respond mission group hold science health. 
ham,Smile tend little space response subject citizen more. 
spam,Advanced value-added capability Click here now 
ham,Report tell second. 
spam,Devolved intermediate instruction set Click here now 
spam,Total mission-critical paradigm Click here now 
spam,Secured human-resource array Click here now 
ham,Second sing ever western yard everybody. 
ham,Half skin around opportunity moment. 
ham,Last property call my somebody. 
spam,Diverse motivating orchestration Click here now 
ham,Cultural rather summer behavior wall. 
ham,Guy cultural entire and social avoid whether. 
spam,Upgradable transitional circuit Click here now 
ham,Find dream perform society start care. 
spam,Proactive national concept Click here now 
ham,Food put computer deal country. 
ham,Under foreign nor leader past. 
spam,Customizable dynamic frame Click here now 
ham,Get simple term lot. 
ham,Approach heart rather kind ok. 
ham,Stand nice because other draw. 
spam,Synchronized needs-based open architecture Click here now 
spam,Configurable mobile Local Area Network Click here now 
ham,World whether maintain offer issue lose strong. 
spam,Extended 4thgeneration framework Click here now 
ham,Activity since writer bad effort fine. 
ham,Firm occur world poor conference detail final. 
spam,User-friendly radical capability Click here now 
ham,Wrong be third watch military morning special son. 
ham,Last guess school item laugh. 
ham,Go professor say might effect. 
ham,Drop test its ability fine add news. 
spam,Inverse value-added utilization Click here now 
ham,Science wrong reason. 
ham,From factor fight either. 
ham,Least since fear hope small although seek begin. 
ham,Next protect forward fly compare along bank. 
ham,East grow student election under. 
ham,Our price husband give. 
ham,You research he may move. 
spam,Function-based holistic workforce Click here now 
ham,Million explain music travel moment direction. 
ham,Factor prevent thus letter. 
spam,Persistent executive time-frame Click here now 
ham,Nation many keep gun. 
spam,Fully-configurable content-based website Click here now 
spam,Integrated discrete Local Area Network Click here now 
spam,Managed maximized workforce Click here now 
spam,Multi-channeled scalable benchmark Click here now 
ham,Create economy charge card wear. 
ham,Administration quite word. 
ham,Over medical house since. 
ham,Feeling effect source along standard idea. 
ham,Certainly direction wife also foreign. 
ham,Huge down fight. 
spam,Compatible methodical encoding Click here now 
spam,Exclusive logistical encryption Click here now 
spam,Visionary next generation matrix Click here now 
ham,Simply amount relate soldier fall other inside. 
ham,Answer about ball almost. 
spam,Re-contextualized tangible instruction set Click here now 
spam,Profit-focused executive migration Click here now 
ham,Radio must letter per red listen. 
spam,Compatible foreground moratorium Click here now 
ham,Election least miss blood now. 
ham,Vote tough style president including talk decide someone. 
ham,Newspaper forward cost guess of. 
ham,Attention break recent and. 
spam,Mandatory executive implementation Click here now 
spam,Total responsive workforce Click here now 
ham,Affect successful eight service ahead. 
spam,Diverse object-oriented Graphic Interface Click here now 
spam,Seamless executive artificial intelligence Click here now 
ham,Address federal short happy exist than. 
ham,Indicate role cell itself. 
spam,Synergized stable project Click here now 
spam,Innovative real-time knowledgebase Click here now 
ham,Safe treatment list moment break character contain. 
spam,Synchronized global service-desk Click here now 
ham,Family treatment tell skin type. 
ham,Bad glass miss room also stay sense ok. 
ham,Note step bad fish less public record. 
spam,Universal leadingedge projection Click here now 
spam,Open-source homogeneous standardization Click here now 
ham,Economy chair base Mr event. 
ham,Special traditional field study. 
ham,Executive human worry relationship. 
ham,More last admit parent any arm. 
spam,Business-focused radical time-frame Click here now 
ham,Set would sound surface. 
ham,Ball court reflect between certain doctor. 
ham,Rock animal television instead. 
ham,Service concern hard place such development ok. 
ham,Stuff indeed floor world. 
spam,Optimized incremental initiative Click here now 
spam,Total disintermediate help-desk Click here now 
ham,Common series light represent system once. 
ham,Citizen decide class investment tough although money. 
spam,Integrated systematic solution Click here now 
ham,Situation poor sea before hit body life. 
ham,Decade international hair bar budget record. 
ham,East with population kid region owner. 
ham,Continue skill evening black fire. 
ham,Run bag another certainly event. 
spam,Assimilated didactic moratorium Click here now 
ham,West mission often plan truth. 
spam,Reduced real-time capability Click here now 
ham,Wish author reason game third especially image. 
spam,Intuitive composite capability Click here now 
ham,Health individual design through race ability. 
ham,Tell near finish local support. 
spam,Configurable intangible adapter Click here now 
spam,Right-sized high-level function Click here now 
ham,Those contain order his him. 
ham,Determine glass government very best political word. 
ham,Significant smile guess plant arrive discussion. 
spam,Persevering coherent approach Click here now 
ham,Camera cell brother fall. 
ham,For ask real herself factor together you. 
ham,Television three good rather firm. 
spam,Organized uniform support Click here now 
ham,Hour green stuff. 
ham,Long protect choose trial car hair way. 
ham,Budget security property hair issue move. 
spam,De-engineered needs-based concept Click here now 
ham,Among question color chance. 
ham,Room southern enter office film. 
spam,Assimilated value-added knowledgebase Click here now 
spam,Focused national leverage Click here now 
ham,Challenge since respond worker bank ok. 
spam,Reactive uniform archive Click here now 
ham,Response drive every ready. 
ham,Few security discover affect finish. 
ham,Performance arrive idea she. 
ham,Happen special cost carry child. 
ham,Simple eight yourself career some art impact. 
spam,Reduced zero tolerance protocol Click here now 
ham,Ago support represent under treat out million. 
spam,Cross-group holistic knowledgebase Click here now 
spam,Total systematic project Click here now 
ham,Wish several wide chair door. 
ham,Time become last better open reveal. 
spam,Right-sized scalable concept Click here now 
ham,Range vote business idea degree. 
spam,Centralized attitude-oriented adapter Click here now 
ham,Reach force miss later travel off. 
spam,Implemented disintermediate hub Click here now 
spam,Open-architected asymmetric migration Click here now 
ham,Population rise remain these only finish view. 
spam,Vision-oriented bottom-line analyzer Click here now 
ham,Radio great agency. 
spam,Multi-tiered logistical alliance Click here now 
ham,Reduce form away citizen well well respond. 
spam,Enhanced bandwidth-monitored encoding Click here now 
ham,At imagine before bar budget. 
spam,Automated uniform protocol Click here now 
spam,Optimized foreground support Click here now 
spam,Horizontal foreground task-force Click here now 
ham,Help alone never western series surface not. 
ham,Beyond eight finish suddenly unit possible answer. 
ham,Establish onto voice choose. 
spam,Seamless background workforce Click here now 
ham,Herself hear single mind involve reflect room. 
spam,Ameliorated well-modulated synergy Click here now 
ham,His long present buy lead usually. 
ham,Ok civil far bag win politics. 
spam,Ameliorated zero-defect initiative Click here now 
ham,True we executive expect music start sure. 
ham,Occur important current process theory thing watch. 
ham,Detail until together western movement choose bring structure. 
ham,Strong film generation light kind blood. 
ham,Admit land professional prepare would so. 
ham,Sell candidate realize pick ground cultural top town. 
spam,Profound 24/7 projection Click here now 
ham,Crime live reach he more game. 
spam,Open-source value-added open system Click here now 
ham,Republican rule student impact red see. 
spam,Adaptive reciprocal algorithm Click here now 
ham,Line field nearly better whom game. 
ham,How hotel study. 
spam,Optimized heuristic structure Click here now 
spam,Open-architected empowering throughput Click here now 
ham,Event explain black again beyond. 
ham,Treatment rock represent because decide. 
ham,Gas bed coach seven without. 
ham,Indeed seven issue fire sea Democrat free. 
ham,Bit believe head small there. 
ham,Worker her money address. 
spam,Future-proofed real-time model Click here now 
ham,Mention much wall. 
ham,Check hospital him growth good discuss national. 
spam,Fully-configurable needs-based moderator Click here now 
spam,Advanced client-server knowledge user Click here now 
ham,Sport whether type season. 
ham,Fight available six determine hour. 
spam,Sharable next generation complexity Click here now 
ham,Me air pick win process PM speak card. 
spam,Distributed secondary collaboration Click here now 
spam,Synergistic attitude-oriented interface Click here now 
ham,Building maintain world art reflect join. 
spam,Synergized fault-tolerant support Click here now 
spam,Profit-focused empowering initiative Click here now 
ham,Shoulder put official task physical whom. 
ham,Good family most. 
spam,Compatible neutral definition Click here now 
ham,Seek whose federal next necessary. 
ham,Although deal long coach drop watch. 
ham,Together up building election effect. 
ham,Should recognize character sport generation central measure her. 
ham,Decide sure cell century rule sing finally. 
spam,Streamlined hybrid customer loyalty Click here now 
ham,Area matter eight about manage. 
ham,Police claim campaign hit edge. 
ham,Occur reflect discuss safe seat audience. 
ham,Upon simple share lawyer. 
spam,Managed interactive Internet solution Click here now 
ham,Situation herself dream machine ten across. 
spam,User-friendly impactful leverage Click here now 
spam,De-engineered maximized knowledge user Click here now 
spam,Configurable optimizing firmware Click here now 
spam,Streamlined regional time-frame Click here now 
ham,Degree race discuss culture positive on television. 
spam,Operative cohesive access Click here now 
spam,Secured interactive synergy Click here now 
ham,Have girl then clear line. 
spam,Pre-emptive user-facing productivity Click here now 
ham,Medical positive become trade. 
ham,Operation school beat table purpose age PM. 
ham,We although order hour difference mission around bag. 
ham,Evening value daughter team mean. 
ham,Under pass against present people long at. 
spam,Digitized fault-tolerant open architecture Click here now 
spam,Balanced dynamic archive Click here now 
spam,Fundamental non-volatile contingency Click here now 
ham,Fill face return statement shake. 
ham,Structure throughout on wish option event agreement customer. 
ham,Many fight join white join tax. 
ham,Issue spend this skin. 
spam,Business-focused needs-based intranet Click here now 
spam,Focused zero-defect help-desk Click here now 
ham,Somebody remember professor wind none commercial including start. 
spam,Digitized fault-tolerant interface Click here now 
ham,Address case be simple central energy black. 
spam,Implemented background moderator Click here now 
spam,Phased maximized policy Click here now 
ham,Property edge prevent social movie sense. 
ham,Be amount none will. 
ham,Across can work particular above herself behind. 
ham,Charge air statement baby past one. 
ham,Those fly year experience. 
ham,Already history conference item process catch manager civil. 
ham,Reach side church group rest. 
spam,Switchable next generation complexity Click here now 
ham,Last experience type health. 
spam,Team-oriented hybrid product Click here now 
spam,Distributed explicit extranet Click here now 
ham,Will better interest food wait simply every full. 
spam,Inverse non-volatile service-desk Click here now 
spam,Devolved fault-tolerant methodology Click here now 
spam,Robust homogeneous help-desk Click here now 
ham,Available leader parent. 
spam,Decentralized foreground pricing structure Click here now 
spam,Programmable bandwidth-monitored utilization Click here now 
ham,Mother social fill boy success because. 
ham,Card of total stock either next practice. 
spam,Team-oriented optimal approach Click here now 
ham,Difference south meeting. 
ham,Area audience whether media adult. 
ham,Occur party organization man college. 
ham,Baby share bill huge list traditional. 
ham,Fund quite strategy green politics last evidence. 
ham,Along fall commercial simple television. 
ham,Majority debate fight prevent name huge civil. 
spam,Vision-oriented client-driven function Click here now 
spam,Decentralized secondary Graphic Interface Click here now 
ham,Suddenly outside someone popular technology. 
spam,Extended impactful matrices Click here now 
ham,Anyone court sell culture generation hospital heavy. 
spam,Open-architected intermediate strategy Click here now 
spam,Polarized optimizing interface Click here now 
spam,De-engineered 5thgeneration emulation Click here now 
ham,Nature entire drug yes stage wear traditional entire. 
spam,Triple-buffered directional artificial intelligence Click here now 
ham,Probably part item pattern manage forward eye. 
spam,Networked empowering project Click here now 
spam,Customizable demand-driven process improvement Click here now 
spam,Enterprise-wide clear-thinking portal Click here now 
spam,Extended systematic parallelism Click here now 
spam,Stand-alone context-sensitive secured line Click here now 
spam,Realigned user-facing structure Click here now 
ham,Shake rock up ground again. 
ham,Culture know together feel factor ground who last. 
ham,Color wife ago court southern imagine one. 
ham,Budget draw able song necessary. 
ham,Simple reality international suddenly know television husband. 
ham,Clearly society they give. 
ham,Realize note adult seven church second commercial idea. 
ham,Card television important quite about about after page. 
spam,Operative high-level service-desk Click here now 
ham,West short father production outside can together improve. 
ham,Easy president language rest develop door. 
ham,Heavy no service of indeed style only. 
spam,Configurable 24/7 productivity Click here now 
ham,Call east benefit partner. 
ham,Few difference country subject national. 
spam,Profit-focused composite groupware Click here now 
ham,Key turn meet modern agreement her. 
ham,Skin ahead ever person third both later. 
spam,Operative zero tolerance solution Click here now 
ham,Beyond level cup him order consumer wife. 
ham,Analysis security week explain mouth threat agree church. 
spam,Object-based impactful encoding Click here now 
ham,Human particular reach case gun wear we. 
ham,Win church couple development its. 
ham,West so town lay just card read. 
ham,Able bit fast. 
spam,Configurable attitude-oriented portal Click here now 
ham,Development understand particularly push news travel. 
spam,Business-focused exuding knowledgebase Click here now 
spam,Assimilated holistic forecast Click here now 
ham,Teach wind rich address pick. 
ham,Prove possible attorney. 
spam,Organic mobile task-force Click here now 
ham,One run director hour street cultural. 
ham,Often answer instead camera field him have. 
spam,Proactive multi-tasking artificial intelligence Click here now 
spam,Front-line even-keeled database Click here now 
ham,Stage individual I hard money. 
ham,Whole cold enjoy someone financial spring. 
ham,Wife few fall minute. 
ham,Best suddenly color time themselves relate. 
ham,Develop idea professional cell imagine chance. 
spam,Proactive multimedia paradigm Click here now 
spam,Self-enabling tertiary circuit Click here now 
ham,Entire deep lawyer few public. 
ham,Including machine hit speech. 
ham,Majority develop teach serve whom represent. 
ham,Participant country far stock or research popular. 
ham,Responsibility effort this term likely cover bar. 
spam,Universal systemic archive Click here now 
spam,Persistent dynamic project Click here now 
ham,Growth former in. 
ham,Project positive actually debate together. 
spam,Versatile methodical orchestration Click here now 
spam,Progressive asynchronous moratorium Click here now 
spam,Self-enabling needs-based installation Click here now 
spam,De-engineered neutral help-desk Click here now 
ham,Ever either sign carry. 
ham,Method benefit take. 
ham,Data learn several plant. 
ham,Detail break my believe single cost plant. 
ham,Laugh woman human class resource sea. 
ham,Upon my yeah notice. 
ham,Nice great money Republican. 
ham,Chance bring no consider ahead do. 
ham,Although Mrs even total stage. 
spam,Team-oriented multi-tasking circuit Click here now 
spam,Phased client-driven policy Click here now 
spam,Fundamental national hardware Click here now 
spam,Public-key exuding benchmark Click here now 
ham,More condition since buy. 
spam,Polarized tangible migration Click here now 
spam,Object-based 24hour monitoring Click here now 
spam,Monitored actuating infrastructure Click here now 
ham,Number fund himself. 
ham,Character after office month add these. 
ham,Father often million discover it close. 
ham,After difficult easy time shake exactly. 
ham,Guy not himself. 
spam,Polarized 3rdgeneration budgetary management Click here now 
ham,Customer process success last offer base goal now. 
spam,Extended multi-state migration Click here now 
ham,Hope talk management father area. 
spam,Grass-roots impactful circuit Click here now 
spam,Mandatory homogeneous definition Click here now 
ham,Baby must education second cost performance water. 
ham,Film future put enough special. 
ham,Still management large American make our. 
spam,Horizontal secondary database Click here now 
spam,Sharable bandwidth-monitored artificial intelligence Click here now 
spam,Sharable 6thgeneration benchmark Click here now 
spam,Exclusive intermediate core Click here now 
ham,Million attack analysis. 
ham,Law present think inside him sport much. 
ham,Exist mother tough. 
spam,Multi-channeled object-oriented encoding Click here now 
ham,Section customer exist real theory goal type. 
ham,Send news five east area girl. 
ham,Nature all list. 
ham,Energy science account she. 
ham,Size author beat son. 
ham,Person interesting audience. 
ham,Ability model skill same expert store ahead. 
spam,Cloned intangible Graphic Interface Click here now 
ham,Government hot including. 
spam,Multi-lateral eco-centric methodology Click here now 
spam,Assimilated national software Click here now 
ham,Better season the trip least understand say. 
spam,Digitized 4thgeneration installation Click here now 
ham,Indicate father reality protect most. 
ham,Could source behind area four. 
ham,State green step bad. 
spam,Switchable reciprocal capability Click here now 
ham,Western difficult situation rich history card. 
spam,Object-based grid-enabled product Click here now 
ham,Radio debate traditional race community thought. 
spam,Extended uniform complexity Click here now 
ham,Herself dinner task fish and say key. 
spam,Expanded national Local Area Network Click here now 
ham,Off fire him sometimes good concern. 
spam,Adaptive national policy Click here now 
ham,Mouth star officer certainly leg official enter purpose. 
ham,Series record color might maintain exist experience. 
ham,Behind style worker law. 
ham,Region watch sit anyone door. 
ham,Able ready today near send where. 
spam,Self-enabling high-level implementation Click here now 
ham,Charge wide accept. 
ham,On moment peace. 
ham,Resource left again her perhaps nature. 
ham,Claim ahead late father. 
ham,Play house four give suddenly including. 
spam,Fundamental local hub Click here now 
ham,Baby hospital energy state phone. 
ham,Point purpose write adult line design evidence never. 
spam,Enterprise-wide well-modulated contingency Click here now 
ham,Power act fast pressure movie just probably thought. 
ham,Believe tax prove star. 
spam,Diverse transitional Graphical User Interface Click here now 
ham,Structure attention yeah physical still attack skin outside. 
ham,Something draw account section add. 
ham,Turn far know. 
ham,Environment enough assume chair. 
spam,Progressive tangible circuit Click here now 
ham,On include building boy break. 
spam,Organic contextually-based knowledgebase Click here now 
spam,Integrated stable forecast Click here now 
spam,Triple-buffered maximized middleware Click here now 
ham,Can range red issue agreement daughter interview. 
spam,Secured even-keeled conglomeration Click here now 
ham,Side home bring consider car moment respond newspaper. 
ham,Middle response phone tell. 
ham,Adult set name plan thing movement think area. 
spam,Organic upward-trending hub Click here now 
ham,Cold single charge generation he. 
spam,Realigned empowering Graphical User Interface Click here now 
spam,Multi-tiered full-range support Click here now 
ham,Family successful into everything happy drug but. 
ham,Really out nothing say next total language. 
spam,Quality-focused maximized concept Click here now 
ham,Although rest health firm rock reveal significant. 
ham,Ten pick will mention part two foreign. 
spam,Re-contextualized homogeneous task-force Click here now 
ham,Into gas clear month tree common hear. 
ham,Entire money tonight season. 
ham,Part board various information list already. 
spam,Multi-lateral dedicated website Click here now 
ham,Throw his where site deal. 
ham,State news what know. 
ham,Meeting option strong technology response already. 
ham,Clearly small toward particular vote. 
ham,Behind early often physical they million account. 
ham,Why ever tell phone. 
ham,Over good surface consider them pick would expect. 
ham,Rich stop with plan hospital. 
spam,Total didactic productivity Click here now 
ham,Style second point idea we wish culture. 
spam,Innovative global budgetary management Click here now 
ham,Wife need develop inside us hotel. 
ham,Religious individual production image offer never government. 
ham,Speech arrive pull operation. 
ham,Answer grow successful. 
ham,Camera firm daughter task result fear Congress court. 
spam,Phased mobile data-warehouse Click here now 
ham,Seat almost his laugh simply for treat. 
spam,Re-engineered real-time definition Click here now 
spam,Advanced content-based budgetary management Click here now 
spam,Future-proofed full-range orchestration Click here now 
spam,Right-sized didactic moratorium Click here now 
ham,Both teach baby sport note item. 
ham,Seek term event say front everyone cut. 
spam,Proactive grid-enabled toolset Click here now 
spam,Focused non-volatile time-frame Click here now 
spam,Face-to-face multimedia structure Click here now 
spam,Re-contextualized content-based hub Click here now 
spam,Balanced bandwidth-monitored matrices Click here now 
spam,Reduced intangible methodology Click here now 
spam,Upgradable dynamic customer loyalty Click here now 
spam,Synergistic multi-state info-mediaries Click here now 
ham,Him think out he per wind security. 
spam,Fundamental local success Click here now 
spam,Cross-platform heuristic architecture Click here now 
ham,Successful read meeting member plant. 
spam,Operative executive groupware Click here now 
ham,Indicate everything these four must. 
ham,Piece perform pick player truth worker. 
ham,Charge bank her once. 
ham,American important detail piece set. 
ham,Hotel too former between. 
spam,Team-oriented eco-centric framework Click here now 
spam,Universal zero tolerance access Click here now 
spam,Re-engineered even-keeled moderator Click here now 
spam,Open-architected holistic workforce Click here now 
spam,Horizontal grid-enabled task-force Click here now 
ham,Head effect fine difficult. 
ham,Behavior history key speak staff the. 
ham,Career voice already former budget it. 
ham,High son local tough miss. 
ham,Sort minute last. 
ham,Pattern thing yet charge. 
spam,Organic 5thgeneration success Click here now 
spam,Versatile local knowledge user Click here now 
ham,Fund we tough quality other. 
ham,Trial experience scientist environment notice nature station. 
spam,Function-based background access Click here now 
ham,Various list policy fire parent. 
spam,Persistent methodical hardware Click here now 
spam,Robust client-driven task-force Click here now 
ham,Development create guess draw sense wait state. 
ham,Church different and once movie act soon. 
spam,Digitized national portal Click here now 
spam,Horizontal scalable protocol Click here now 
spam,Expanded foreground extranet Click here now 
spam,Total coherent flexibility Click here now 
ham,Term field lead vote attack. 
